{
  "schemaVersion": 1,
  "contentVersion": 1,
  "id": "fixture-full-feature",
  "title": "Fixture Full Feature Tree",
  "summary": "Exercises every §5.3 field for schema validation.",
  "domain": "making",
  "secondaryDomains": [
    "home"
  ],
  "subregion": "objects",
  "facets": [
    "physical",
    "workshop"
  ],
  "archetype": "dual-track",
  "tracks": [
    {
      "id": "forge",
      "title": "Forge work"
    },
    {
      "id": "finishing",
      "title": "Heat treat and finish"
    }
  ],
  "provenance": {
    "authors": [
      {
        "name": "Fixture Author",
        "github": "fixture"
      }
    ],
    "reviews": [
      {
        "round": 1,
        "reviewer": "Reviewer",
        "date": "2026-09-02"
      }
    ],
    "sources": [
      {
        "title": "Example source",
        "url": "https://example.org",
        "adapted": "sequencing"
      }
    ],
    "copyleftDerived": false
  },
  "levels": [
    {
      "level": 1,
      "milestones": [
        {
          "index": 0,
          "slug": "light-the-forge"
        },
        {
          "index": 1,
          "slug": "draw-a-taper"
        },
        {
          "index": 2,
          "slug": "make-a-j-hook"
        },
        {
          "index": 3,
          "slug": "quench-safely"
        }
      ],
      "requirements": [
        {
          "rule": "all",
          "milestones": [
            {
              "index": 0,
              "slug": "light-the-forge"
            },
            {
              "index": 1,
              "slug": "draw-a-taper"
            },
            {
              "index": 2,
              "slug": "make-a-j-hook"
            },
            {
              "index": 3,
              "slug": "quench-safely"
            }
          ]
        }
      ]
    },
    {
      "level": 2,
      "milestones": [
        {
          "index": 4,
          "slug": "forge-a-leaf"
        },
        {
          "index": 5,
          "slug": "punch-and-drift"
        },
        {
          "index": 6,
          "slug": "hot-cut"
        },
        {
          "index": 7,
          "slug": "wire-brush-finish"
        }
      ],
      "requirements": [
        {
          "rule": "all",
          "milestones": [
            {
              "index": 4,
              "slug": "forge-a-leaf"
            },
            {
              "index": 5,
              "slug": "punch-and-drift"
            },
            {
              "index": 6,
              "slug": "hot-cut"
            }
          ]
        },
        {
          "rule": "n_of",
          "n": 1,
          "milestones": [
            {
              "index": 7,
              "slug": "wire-brush-finish"
            }
          ]
        }
      ]
    },
    {
      "level": 3,
      "milestones": [
        {
          "index": 8,
          "slug": "l3-a"
        },
        {
          "index": 9,
          "slug": "l3-b"
        },
        {
          "index": 10,
          "slug": "l3-c"
        },
        {
          "index": 11,
          "slug": "l3-d"
        }
      ],
      "requirements": [
        {
          "rule": "n_of",
          "n": 2,
          "milestones": [
            {
              "index": 8,
              "slug": "l3-a"
            },
            {
              "index": 9,
              "slug": "l3-b"
            },
            {
              "index": 10,
              "slug": "l3-c"
            },
            {
              "index": 11,
              "slug": "l3-d"
            }
          ]
        }
      ]
    },
    {
      "level": 4,
      "milestones": [
        {
          "index": 12,
          "slug": "l4-a"
        },
        {
          "index": 13,
          "slug": "l4-b"
        },
        {
          "index": 14,
          "slug": "l4-c"
        },
        {
          "index": 15,
          "slug": "l4-d"
        }
      ],
      "requirements": [
        {
          "rule": "all",
          "milestones": [
            {
              "index": 12,
              "slug": "l4-a"
            },
            {
              "index": 13,
              "slug": "l4-b"
            },
            {
              "index": 14,
              "slug": "l4-c"
            },
            {
              "index": 15,
              "slug": "l4-d"
            }
          ]
        }
      ]
    },
    {
      "level": 5,
      "milestones": [
        {
          "index": 16,
          "slug": "l5-a"
        },
        {
          "index": 17,
          "slug": "l5-b"
        },
        {
          "index": 18,
          "slug": "l5-c"
        },
        {
          "index": 19,
          "slug": "l5-d"
        }
      ],
      "requirements": [
        {
          "rule": "all",
          "milestones": [
            {
              "index": 16,
              "slug": "l5-a"
            },
            {
              "index": 17,
              "slug": "l5-b"
            },
            {
              "index": 18,
              "slug": "l5-c"
            },
            {
              "index": 19,
              "slug": "l5-d"
            }
          ]
        }
      ]
    },
    {
      "level": 6,
      "milestones": [
        {
          "index": 20,
          "slug": "l6-a"
        },
        {
          "index": 21,
          "slug": "l6-b"
        },
        {
          "index": 22,
          "slug": "l6-c"
        },
        {
          "index": 23,
          "slug": "l6-d"
        }
      ],
      "requirements": [
        {
          "rule": "all",
          "milestones": [
            {
              "index": 20,
              "slug": "l6-a"
            },
            {
              "index": 21,
              "slug": "l6-b"
            },
            {
              "index": 22,
              "slug": "l6-c"
            },
            {
              "index": 23,
              "slug": "l6-d"
            }
          ]
        }
      ]
    },
    {
      "level": 7,
      "milestones": [
        {
          "index": 24,
          "slug": "l7-a"
        },
        {
          "index": 25,
          "slug": "l7-b"
        },
        {
          "index": 26,
          "slug": "l7-c"
        },
        {
          "index": 27,
          "slug": "l7-d"
        }
      ],
      "requirements": [
        {
          "rule": "all",
          "milestones": [
            {
              "index": 24,
              "slug": "l7-a"
            },
            {
              "index": 25,
              "slug": "l7-b"
            },
            {
              "index": 26,
              "slug": "l7-c"
            },
            {
              "index": 27,
              "slug": "l7-d"
            }
          ]
        }
      ]
    },
    {
      "level": 8,
      "milestones": [
        {
          "index": 28,
          "slug": "l8-a"
        },
        {
          "index": 29,
          "slug": "l8-b"
        },
        {
          "index": 30,
          "slug": "l8-c"
        },
        {
          "index": 31,
          "slug": "l8-d"
        }
      ],
      "requirements": [
        {
          "rule": "all",
          "milestones": [
            {
              "index": 28,
              "slug": "l8-a"
            },
            {
              "index": 29,
              "slug": "l8-b"
            },
            {
              "index": 30,
              "slug": "l8-c"
            },
            {
              "index": 31,
              "slug": "l8-d"
            }
          ]
        }
      ]
    },
    {
      "level": 9,
      "milestones": [
        {
          "index": 32,
          "slug": "l9-a"
        },
        {
          "index": 33,
          "slug": "l9-b"
        },
        {
          "index": 34,
          "slug": "l9-c"
        },
        {
          "index": 35,
          "slug": "l9-d"
        }
      ],
      "requirements": [
        {
          "rule": "all",
          "milestones": [
            {
              "index": 32,
              "slug": "l9-a"
            },
            {
              "index": 33,
              "slug": "l9-b"
            },
            {
              "index": 34,
              "slug": "l9-c"
            },
            {
              "index": 35,
              "slug": "l9-d"
            }
          ]
        }
      ]
    },
    {
      "level": 10,
      "milestones": [
        {
          "index": 36,
          "slug": "l10-a"
        },
        {
          "index": 37,
          "slug": "l10-b"
        },
        {
          "index": 38,
          "slug": "l10-c"
        },
        {
          "index": 39,
          "slug": "l10-d"
        }
      ],
      "requirements": [
        {
          "rule": "all",
          "milestones": [
            {
              "index": 36,
              "slug": "l10-a"
            },
            {
              "index": 37,
              "slug": "l10-b"
            },
            {
              "index": 38,
              "slug": "l10-c"
            },
            {
              "index": 39,
              "slug": "l10-d"
            }
          ]
        }
      ]
    }
  ],
  "mastery": [
    {
      "id": "damascus-billet",
      "uid": "r6bk28vy",
      "title": "Forge-weld a billet",
      "detail": "Produce a pattern-welded billet."
    },
    {
      "id": "teach-a-course",
      "uid": "n4pz73gd",
      "title": "Run a forging course",
      "detail": "Lead a multi-session forging class.",
      "requires": [
        {
          "kind": "milestone",
          "index": 36,
          "slug": "l10-a"
        },
        {
          "kind": "achievement",
          "index": 0,
          "slug": "damascus-billet"
        }
      ]
    }
  ],
  "lineage": [
    {
      "uid": "q4np8w2r",
      "op": "split",
      "into": [
        "m3xk90ab",
        "v8t2ncq5"
      ],
      "note": "example split"
    }
  ],
  "milestones": [
    {
      "id": "light-the-forge",
      "uid": "k7m2qp9x",
      "aliases": [
        "light-forge"
      ],